{
  "id": "rel-a1b2c3",
  "type": "employed_by",
  "from_id": "ent-a1b2c3",
  "to_id": "ent-j1k2l3",
  "status": "primary",
  "valid_from": "2019-03-01T00:00:00Z",
  "valid_to": "2024-11-30T00:00:00Z",
  "expired_at": null,
  "source": "stated",
  "stated_by_person_id": "person-a1b2c3",
  "confidence": null,
  "confirmed_by_person_id": null,
  "confirmed_at": null,
  "evidence": [],
  "scope": "household",
  "person": null,
  "sensitive": false,
  "note": "A former job: valid_to is set, and no status is needed to say so.",
  "created_at": "2026-09-05T12:00:00Z",
  "updated_at": "2026-09-05T12:00:00Z",
  "deleted_at": null,
  "hlc": "1757073600000:0:a1b2c3"
}
